{
  "$schema": "https://json-schema.org/draft/2020-12/schema",
  "$id": "https://tripwire.local/schemas/chart.schema.json",
  "title": "chart.json — the EAR Country Chart, five destinations",
  "description": "Supplement No. 1 to 15 CFR 738, content date 2026-09-01. A country row has SEVENTEEN <TD> children in the source XML: cell[0] is the country name and cells[1..16] are the sixteen control columns. Empty cells are meaningful and must be preserved. Footnotes are <sup> elements, not glued digits.",
  "type": "object",
  "required": ["source_file", "ecfr_date", "column_headers", "countries"],
  "properties": {
    "source_file": { "type": "string" },
    "ecfr_date": { "type": "string", "const": "2026-09-01" },
    "column_headers": {
      "type": "array", "minItems": 16, "maxItems": 16,
      "items": { "type": "string" },
      "description": "CB 1 · CB 2 · CB 3 · NP 1 · NP 2 · NS 1 · NS 2 · MT 1 · RS 1 · RS 2 · FC 1 · CC 1 · CC 2 · CC 3 · AT 1 · AT 2"
    },
    "countries": {
      "type": "object",
      "propertyNames": { "enum": ["CA", "DE", "TW", "VN", "CN"] },
      "additionalProperties": {
        "type": "object",
        "required": ["country_name_raw", "country_name_clean", "cells"],
        "properties": {
          "country_name_raw": { "type": "string" },
          "country_name_clean": { "type": "string" },
          "footnote": { "type": ["string", "null"] },
          "cells": {
            "type": "array", "minItems": 16, "maxItems": 16,
            "items": { "type": "string" },
            "description": "'X' or ''. Empties preserved — '' means the column does NOT apply."
          },
          "columns": { "type": "object", "additionalProperties": { "type": "string" } }
        }
      }
    }
  }
}
