{
  "source_file": "ecfr/title-15-part-738-appendix-suppl1-2026-09-01.xml",
  "ecfr_date": "2026-09-01",
  "column_headers": [
    "CB 1",
    "CB 2",
    "CB 3",
    "NP 1",
    "NP 2",
    "NS 1",
    "NS 2",
    "MT 1",
    "RS 1",
    "RS 2",
    "FC 1",
    "CC 1",
    "CC 2",
    "CC 3",
    "AT 1",
    "AT 2"
  ],
  "countries": {
    "CA": {
      "country_name_raw": "Canada",
      "country_name_clean": "Canada",
      "footnote": null,
      "cells": [
        "X",
        "",
        "",
        "",
        "",
        "",
        "",
        "",
        "",
        "",
        "X",
        "",
        "",
        "",
        "",
        ""
      ],
      "columns": {
        "CB 1": "X",
        "CB 2": "",
        "CB 3": "",
        "NP 1": "",
        "NP 2": "",
        "NS 1": "",
        "NS 2": "",
        "MT 1": "",
        "RS 1": "",
        "RS 2": "",
        "FC 1": "X",
        "CC 1": "",
        "CC 2": "",
        "CC 3": "",
        "AT 1": "",
        "AT 2": ""
      }
    },
    "DE": {
      "country_name_raw": "Germany 3",
      "country_name_clean": "Germany",
      "footnote": "3",
      "cells": [
        "X",
        "",
        "",
        "",
        "",
        "X",
        "",
        "X",
        "X",
        "",
        "",
        "",
        "",
        "",
        "",
        ""
      ],
      "columns": {
        "CB 1": "X",
        "CB 2": "",
        "CB 3": "",
        "NP 1": "",
        "NP 2": "",
        "NS 1": "X",
        "NS 2": "",
        "MT 1": "X",
        "RS 1": "X",
        "RS 2": "",
        "FC 1": "",
        "CC 1": "",
        "CC 2": "",
        "CC 3": "",
        "AT 1": "",
        "AT 2": ""
      }
    },
    "TW": {
      "country_name_raw": "Taiwan",
      "country_name_clean": "Taiwan",
      "footnote": null,
      "cells": [
        "X",
        "X",
        "X",
        "X",
        "",
        "X",
        "X",
        "X",
        "X",
        "X",
        "",
        "X",
        "",
        "X",
        "",
        ""
      ],
      "columns": {
        "CB 1": "X",
        "CB 2": "X",
        "CB 3": "X",
        "NP 1": "X",
        "NP 2": "",
        "NS 1": "X",
        "NS 2": "X",
        "MT 1": "X",
        "RS 1": "X",
        "RS 2": "X",
        "FC 1": "",
        "CC 1": "X",
        "CC 2": "",
        "CC 3": "X",
        "AT 1": "",
        "AT 2": ""
      }
    },
    "VN": {
      "country_name_raw": "Vietnam",
      "country_name_clean": "Vietnam",
      "footnote": null,
      "cells": [
        "X",
        "X",
        "X",
        "X",
        "",
        "X",
        "X",
        "X",
        "X",
        "X",
        "",
        "X",
        "X",
        "",
        "",
        ""
      ],
      "columns": {
        "CB 1": "X",
        "CB 2": "X",
        "CB 3": "X",
        "NP 1": "X",
        "NP 2": "",
        "NS 1": "X",
        "NS 2": "X",
        "MT 1": "X",
        "RS 1": "X",
        "RS 2": "X",
        "FC 1": "",
        "CC 1": "X",
        "CC 2": "X",
        "CC 3": "",
        "AT 1": "",
        "AT 2": ""
      }
    },
    "CN": {
      "country_name_raw": "China",
      "country_name_clean": "China",
      "footnote": null,
      "cells": [
        "X",
        "X",
        "X",
        "X",
        "X",
        "X",
        "X",
        "X",
        "X",
        "X",
        "",
        "X",
        "",
        "X",
        "",
        ""
      ],
      "columns": {
        "CB 1": "X",
        "CB 2": "X",
        "CB 3": "X",
        "NP 1": "X",
        "NP 2": "X",
        "NS 1": "X",
        "NS 2": "X",
        "MT 1": "X",
        "RS 1": "X",
        "RS 2": "X",
        "FC 1": "",
        "CC 1": "X",
        "CC 2": "",
        "CC 3": "X",
        "AT 1": "",
        "AT 2": ""
      }
    }
  }
}